title,originallink,link,description,pubDate
"""수면 유도 '멜라토닌', 만성 통증 억제 효과 가능성""",http://health.chosun.com/site/data/html_dir/2020/06/02/2020060201608.html,https://n.news.naver.com/mnews/article/346/0000032327?sid=103,"적은 멜라토닌의 추가적 투여가 별 영향을 주지 못한 것으로 해석한다”고 말했다. 명 교수는 “단, 더 많은 임상시험을 통해 그 효능이 입증되어야 하며, 부작용에 대해 보고한 연구가 많지 않아 안전성에 대해서도... ","Tue, 02 Jun 2020 10:56:00 +0900"
"명승권 국립암센터 국제암대학원대학 교수, 불면증·수면장애 사용 ‘멜...",http://www.nspna.com/news/?mode=view&newsid=432193,http://www.nspna.com/news/?mode=view&newsid=432193,때문에 멜라토닌의 만성 통증에 대한 진통효과가 확실하게 규명된 것은 아니고 가능성을 확인한 것일 뿐이다”며 “더 많은 임상시험을 통해 그 효능이 입증돼야 하며 부작용에 대해 보고한 연구가 많지 않아... ,"Tue, 02 Jun 2020 10:30:00 +0900"
"""수면장애 치료 사용 '멜라토닌', 만성 통증 감소 효과 가능성""",http://www.medisobizanews.com/news/articleView.html?idxno=70154,http://www.medisobizanews.com/news/articleView.html?idxno=70154,"때문에 멜라토닌의 만성 통증에 대한 진통 효과가 확실히 규명된 것은 아니라 가능성을 확인한 것일 뿐""이라며 ""더 많은 임상을 통해 그 효능이 입증돼야 하고, 부작용에 대해 보고한 연구가 많지 않아 안전성에... ","Tue, 02 Jun 2020 09:58:00 +0900"
"대한민국 꿀잠자기 프로젝트 (3) 직구로 사는 멜라토닌, 먹어도 괜찮을...",http://www.hidoc.co.kr/healthstory/news/C0000418187,http://www.hidoc.co.kr/healthstory/news/C0000418187,여러 가지 건강식품 중에서도 비교적 부작용이 적고 안전하다고 알려져 있는 ‘멜라토닌(melatonin)’ 제형에 대한 관심도 대폭 증가했다. 멜라토닌은 해가 지면 자연적으로 송과체(pineal gland)라는 뇌 내의 작은... ,"Mon, 30 Jul 2018 09:00:00 +0900"
"SK케미칼, 멜라토닌 성분 불면증치료제 ‘라톤’ 출시",http://www.whosaeng.com/121947,http://www.whosaeng.com/121947,"체내 생성 호르몬인 멜라토민은 기존 수면제보다 의존, 내성 등 부작용이 적은 것이 장점이다. SK케미칼 정한조 팀장은 “OECD 최고 수준의 국내 고령화에 따라 멜라토닌 감소로 인한 불면증을 호소하는 중장년 환자가... ","Mon, 26 Oct 2020 10:20:00 +0900"
"잠을 이룰 수 없는 봄밤, 도와줘요, 멜라토닌",http://www.vogue.co.kr/2019/04/11/%ec%9e%a0%ec%9d%84-%ec%9d%b4%eb%a3%b0-%ec%88%98-%ec%97%86%eb%8a%94-%eb%b4%84%eb%82%a0-%eb%b0%a4-%eb%8f%84%ec%99%80%ec%a4%98%ec%9a%94-%eb%a9%9c%eb%9d%bc%ed%86%a0%eb%8b%8c/?utm_source=naver&utm_medium=partnership,http://www.vogue.co.kr/2019/04/11/%ec%9e%a0%ec%9d%84-%ec%9d%b4%eb%a3%b0-%ec%88%98-%ec%97%86%eb%8a%94-%eb%b4%84%eb%82%a0-%eb%b0%a4-%eb%8f%84%ec%99%80%ec%a4%98%ec%9a%94-%eb%a9%9c%eb%9d%bc%ed%86%a0%eb%8b%8c/?utm_source=naver&utm_medium=partnership,"심각한 부작용을 유발하는 다른 수면 보조제보다는 낫지만, 멜라토닌 역시 섭취 시 성 기능과 관련된 부작용이 발생할 수 있습니다. 시중에 판매하는 멜라토닌 보충제의 경우 라벨에 표시된 성분과 실제 성분이 다른... ","Thu, 11 Apr 2019 18:42:00 +0900"
[가을숙면③]수면제 알고 먹어야…시차적응에 멜라토닌 효과,http://news1.kr/articles/?3102635,https://n.news.naver.com/mnews/article/421/0002948057?sid=103,내 부작용이 적다. 수면유도제에 주로 사용되는 성분은 수면호르몬으로 불리는 '멜라토닌'이다. 멜라토닌은 낮에는 분비가 억제되어 있다가 밤이 되면 뇌에서 분비되는 호르몬이다. 몸의 열을 떨어뜨리고 혈압과 혈당을... ,"Sun, 17 Sep 2017 07:00:00 +0900"
[과학을읽다]'감각공해' 벗어날 수 있는 방법은?,https://view.asiae.co.kr/article/2019092415073696614,https://n.news.naver.com/mnews/article/277/0004541687?sid=105,"또 수면장애, 비만, 당뇨, 우울증 등의 부작용과 생체 호르몬인 멜라토닌 분비를 교란시켜 암 발병률도 높입니다. 세계보건기구(WHO) 산하 국제암연구기구(IARC)는 빛공해를 발암물질로 지정했습니다. 환경부에 따르면... ","Wed, 25 Sep 2019 06:30:00 +0900"
"해외직구 인기 수면 호르몬 ‘멜라토닌’, 괜찮나?",http://news.donga.com/3/all/20170515/84357382/1,https://n.news.naver.com/mnews/article/020/0003064459?sid=103,[동아일보] 멜라토닌 제제 허와 실 해외 출장 후 시차 탓에 고생하던 회사원 한모 씨(38)는 동료가 ‘잠 잘 오는 캡슐’이라며 건넨 수면 호르몬 멜라토닌의 효과를 톡톡히 봤다. 향정신성 수면제보다 부작용이 적다는 점이... ,"Mon, 15 May 2017 03:03:00 +0900"
"내성 생길라, 수면제 계속 먹어도 될까",https://radio.ytn.co.kr/program/?f=2&id=97318&s_mcd=0433&s_hcd=01,https://radio.ytn.co.kr/program/?f=2&id=97318&s_mcd=0433&s_hcd=01,약물의 부작용으로 수면 방해가 발생할 수 있습니다 그래서 이런 약물을 복용하시는 분들은 참고하시면 좋을... ◆박귀빈:그런데 많은 사람들이 알고 있는 멜라토닌인 것 같은데 이것은 식약처에서 허가된거 아닌가요?... ,"Thu, 08 Aug 2024 14:00:00 +0900"
"내성 생길라, 수면제 계속 먹어도 될까",https://www.ytn.co.kr/_ln/0103_202408081126248321,https://n.news.naver.com/mnews/article/052/0002071742?sid=102,약물의 부작용으로 수면 방해가 발생할 수 있습니다 그래서 이런 약물을 복용하시는 분들은 참고하시면 좋을... ◆박귀빈:그런데 많은 사람들이 알고 있는 멜라토닌인 것 같은데 이것은 식약처에서 허가된거 아닌가요?... ,"Thu, 08 Aug 2024 11:26:00 +0900"
잠 안 오는데 수면제는 무섭고… 약국서 '수면유도제' 사 먹어볼까? [이...,https://health.chosun.com/site/data/html_dir/2024/07/25/2024072501421.html,https://n.news.naver.com/mnews/article/346/0000077956?sid=103,"서방정을 온라인을 통해 해외직구하는 경우가 있는데, 이는 엄연히 불법이다. 엄준철 약사는 ""멜라토닌 서방정은 해외직구 자체가 불법이기 때문에 복용 후 부작용이 생겨도 국가에서 피해보상을 해주지 않는다""고 말했다.","Fri, 26 Jul 2024 07:16:00 +0900"
"제주항공, '멜라토닌' 면세점 판매 전면중단",http://www.mdtoday.co.kr/mdtoday/index.html?no=323361,http://www.mdtoday.co.kr/mdtoday/index.html?no=323361,이는 멜라토닌을 13주 이상 복용시 불면증을 유발하거나 악화시키는 부작용을 가지고 있기 때문. 하지만 면세점에서의 멜라토닌 판매는 불법이 아니다. 국내에서 판매가 금지된 건강기능식품도 기내·온라인 면세점 등... ,"Mon, 11 Jun 2018 07:06:00 +0900"
[신성종 목사의 영적전쟁 (111)] 우울증과 귀신들림,,https://n.news.naver.com/mnews/article/005/0000160719?sid=103,보통 수면제는 습관성이 생기기 때문에 해롭지만 멜라토닌은 매일 먹어도 부작용이 전혀 없다. 두 가지 약 모두 다이어트 보충제로 사용되기도 한다. 중요한 것은 약이란 원칙적으로 의사의 허락 없이 사용할 때에는... ,"Tue, 11 May 2004 15:30:00 +0900"
"멜라토닌, 생체 리듬 관장하는 필수 호르몬…혈당·혈압 조절에 관여",http://www.newsculture.press/view.htm?idxno=2019041711095918042,http://www.newsculture.press/view.htm?idxno=2019041711095918042,"이날 출연한 배연정은 ""내가 잠을 못 자니까 미국에 있는 딸이 멜라토닌 호르몬제를 사다줬다. 이게 부작용이 없냐""라고 물었다. 이에 가정의학과 전문의 안지현은 ""우리나라에서 멜라토닌 호르몬제는 의사의 처방을... ","Wed, 17 Apr 2019 11:30:00 +0900"
[약 되는 약 이야기] '천연 수면제' 멜라토닌,http://news20.busan.com/controller/newsController.jsp?newsId=20151130000019,https://n.news.naver.com/mnews/article/082/0000554757?sid=102,많은 부작용이 있지만 수면제의 복용을 중단하지 못하는 이유는 당장 불편함이 크기 때문이다. 우리 몸에는 수면을 결정하는 수면호르몬인 멜라토닌이라는 천연 수면제가 있다. 뇌의 송과선에서 분비되는 호르몬이... ,"Sun, 29 Nov 2015 19:09:00 +0900"
"[건강한 인생] 맘 먹고 간 해외여행, 藥 먹고 돌아다녀서야…",http://www.hankyung.com/news/app/newsview.php?aid=2007061782041,https://n.news.naver.com/mnews/article/015/0000970996?sid=102,해외여행 중 잠이 오지 않으면 숙면을 유도하는 멜라토닌을 복용한다. 부작용이 적고 항산화기능이 있다. 수면제는 되도록 피하되 정 필요하면 처방전 없이 살수 있는 항히스타민제 계열 수면유도제를 사용해본다.... ,"Mon, 18 Jun 2007 18:32:00 +0900"
"잠이 보약... 수면 호르몬 '멜라토닌', 유방암 치료제로 급부상",http://www.whitepaper.co.kr/news/articleView.html?idxno=132420,http://www.whitepaper.co.kr/news/articleView.html?idxno=132420,"유방암 1, 2세대 항암제가 가진 부작용도 없을 뿐만 아니라 골흡수를 촉진하는 세포를 억제해 골다공증을 예방하는 효과까지 갖추고 있었다. 야간 수면이 멜라토닌의 생성과 깊게 관계하고, 나아가 유방암 발병과 치료에... ","Tue, 11 Dec 2018 16:48:00 +0900"
우울증 ④,http://www.whosaeng.com/167240,http://www.whosaeng.com/167240,"베타차단제는 멜라토닌 분비를 억제하여 수면 개시를 방해할 수 있다. 약물 복용 시간, 용량, 약물 간... 약물치료는 부작용에 민감한 노인을 대상으로 할 때 더욱 신중하게 접근해야 한다. 기본 원칙은 “최소한의... ","Tue, 13 Jan 2026 09:30:00 +0900"
[불면증 예방·치료법] 나이 들어 깊은 잠 못 잔다면 멜라토닌이 해법,http://www.koreadaily.com/news/read.asp?art_id=2677349,http://www.koreadaily.com/news/read.asp?art_id=2677349,"실제로 만성불면증에 시달리는 노인 환자를 대상으로 2주간 멜라토닌 2㎎을 취침 전 복용하게 하자 별다른 부작용 없이 수면의 질이 개선된 것으로 나타났다. 단순히 잠이 오지 않는다고 불면증은 아니다. 홍 교수는 ""잠을... ","Wed, 16 Jul 2014 17:28:00 +0900"
'꿀잠'이 그리운 당신…수면제보다 멜라토닌,http://www.kookje.co.kr/news2011/asp/newsbody.asp?code=0700&key=20160503.22025195003,http://www.kookje.co.kr/news2011/asp/newsbody.asp?code=0700&key=20160503.22025195003,"불면증이 있을 경우 수면제보다는 멜라토닌을 복용하는 것이 현명한 방법이다. 수면제를 먹게 되면 일시적으로 잠은 잘 올 수 있지만 그에 따른 부작용도 만만치 않다. 약물 의존성이 생길 수 있고 부작용으로 두통, 잠을... ","Tue, 03 May 2016 00:16:00 +0900"
폐경 후 불면증에 멜라토닌 치료제‥의사들 평가는?,http://medipana.com/news/news_viewer.asp?NewsNum=180578&MainKind=A&NewsKind=5&vCount=12&vKind=1,http://medipana.com/news/news_viewer.asp?NewsNum=180578&MainKind=A&NewsKind=5&vCount=12&vKind=1,작용시간이나 부작용을 고려한 약들이 각광을 받고 있는 것. 지난 10일 대한폐경학회 제45차 춘계연수강좌에 참석한 가톨릭대학교 성빈센트병원 정신건강의학과 홍승철 교수<사진>는 '수면장애 치료-호르몬제와 멜라토닌... ,"Mon, 11 Apr 2016 07:46:00 +0900"
"‘오메가3 오메가3란,비타민D’ 멜라토닌 성분으로 불면증에도 효과적이...",http://www.polinews.co.kr/news/article.html?no=449552,http://www.polinews.co.kr/news/article.html?no=449552,"멜라토닌 성분으로 불면증에도 효과적이다. 오메가3의 부작용은 중금속 축적의 우려가 있어 제품선택에 유의해야 하며, 간질환 및 간염을 가지고 있을 경우 출혈 등의 부작용을 초래할 수 있어 섭취 전 의사와의 상담이... ","Sun, 19 Jan 2020 02:52:00 +0900"
"밤새 뒤척뒤척 ""도저히 잠이 안 와요""…마시면 푹 잔다는 '꿀잠 음료', ...",https://www.sedaily.com/NewsView/2K77JPWPTA,https://n.news.naver.com/mnews/article/011/0004575571?sid=103,"최근에는 멜라토닌과 심부전의 연관성을 제기한 연구 결과가 나오면서 논란도 이어지고 있다. 부작용 우려도 있다. 수면 보조 음료는 일부 처방약과 상호작용할 수 있고, 마그네슘은 위장 장애를, 고용량 멜라토닌은... ","Wed, 07 Jan 2026 01:06:00 +0900"
[Health&Beauty]수면제 오래 먹으면 치매 온다? 멜라토닌 성분이면 괜찮...,http://news.donga.com/3/all/20141111/67801865/1,https://n.news.naver.com/mnews/article/020/0002686607?sid=105,"각종 부작용이 있을 수 있다. 또 모든 수면제가 치매와 무조건 연관이 있는 것은 아니다. 먼저 계열과 성분이 무엇인지 봐야 한다”면서 “최근엔 비(非)향정신성 계열의 멜라토닌 성분 불면증 치료제가 나왔는데, 이는... ","Wed, 12 Nov 2014 03:03:00 +0900"
"'오메가3 콜레스테롤,크릴오일' 멜라토닌 성분으로 불면증에도 효과적이...",http://www.insightkorea.co.kr/news/articleView.html?idxno=77672,http://www.insightkorea.co.kr/news/articleView.html?idxno=77672,"멜라토닌 성분으로 불면증에도 효과적이다. 오메가3의 부작용은 중금속 축적의 우려가 있어 제품선택에 유의해야 하며, 간질환 및 간염을 가지고 있을 경우 출혈 등의 부작용을 초래할 수 있어 섭취 전 의사와의 상담이... ","Sun, 01 Mar 2020 00:52:00 +0900"
"[Health&Beauty/헬스캡슐]건일제약, 국내 최초 멜라토닌 성분 불면증 치...",http://news.donga.com/3/all/20140819/65833188/1,https://n.news.naver.com/mnews/article/020/0002633461,"서카딘은 내인성멜라토닌과 유사하게 방출되는 최초의 서방형멜라토닌으로 기존 약에 비해 부작용이 적다. 실제 55세 이상의 불면증 환자를 대상으로 임상실험을 한 결과 서카딘 복용 후 수면의 질, 잠들기까지 걸리는... ","Wed, 20 Aug 2014 03:02:00 +0900"
"건일제약, 멜라토닌서방정 `서카딘` 론칭‥""잠이 보약""",http://medipana.com/news/news_viewer.asp?NewsNum=155045&MainKind=A&NewsKind=5&vCount=12&vKind=1,http://medipana.com/news/news_viewer.asp?NewsNum=155045&MainKind=A&NewsKind=5&vCount=12&vKind=1,"서카딘은 내인성 멜라토닌과 유사하게 방출되는 최초의 서방형 멜라토닌으로서 수면의 질을 개선할 뿐만 아니라 기존수면제 대비 부작용을 낮춘 것이 특징이며, 기존 수면제가 향정신성의약품으로 1회 3~4주로 처방이... ","Tue, 19 Aug 2014 18:42:00 +0900"
"건일제약㈜, 멜라토닌 성분의 신개념 불면증 치료제 '서카딘®' 국내 전...",http://www.sisaweek.com/news/articleView.html?idxno=25848,http://www.sisaweek.com/news/articleView.html?idxno=25848,"서카딘(R)은 내인성 멜라토닌과 유사하게 방출되는 최초의 서방형 멜라토닌으로, 수면의 질을 개선할 뿐만 아니라 기존약에 비해 부작용이 낮은 게 특징이다. 실제로 55세 이상의 불면증 환자를 대상으로 한... ","Tue, 22 Jul 2014 20:11:00 +0900"
"건일제약,멜라토닌 성분의 신개념 불면증 치료제 '서카딘' 출시",http://www.kpanews.co.kr/article/show.asp?idx=155215&table=article&category=D,http://www.kpanews.co.kr/article/show.asp?idx=155215&table=article&category=D,"서카딘은 내인성멜라토닌과 유사하게 방출되는 최초의 서방형멜라토닌으로, 수면의 질을 개선할 뿐만 아니라 기존약에 비해 부작용이 낮은게 특징이다. 실제 55세 이상의 불면증 환자를 대상으로 한 국내임상에서... ","Tue, 22 Jul 2014 18:09:00 +0900"
"건일제약(㈜, 멜라토닌 성분의 신개념 불면증치료제 ‘서카딘’ 국내 전...",http://www.sportsworldi.com/content/html/2014/07/22/20140722003608.html?OutUrl=naver,https://n.news.naver.com/mnews/article/396/0000224173?sid=103,"서카딘(R)은 내인성 멜라토닌과 유사하게 방출되는 최초의 서방형 멜라토닌으로, 수면의 질을 개선할 뿐만 아니라 기존약에 비해 부작용이 낮은게 특징이다. 실제로 55세 이상의 불면증 환자를 대상으로 한 국내... ","Tue, 22 Jul 2014 16:30:00 +0900"
"건일제약, 멜라토닌 성분 세계 유일한 전문약 출시",http://medipana.com/news/news_viewer.asp?NewsNum=154266&MainKind=A&NewsKind=5&vCount=12&vKind=1,http://medipana.com/news/news_viewer.asp?NewsNum=154266&MainKind=A&NewsKind=5&vCount=12&vKind=1,"`서카딘`은 내인성멜라토닌과 유사하게 방출되는 최초의 서방형멜라토닌으로, 수면의 질을 개선할 뿐만 아니라 기존약에 비해 부작용이 낮은게 특징이다. 실제로 55세 이상의 불면증 환자를 대상으로 한... ","Tue, 22 Jul 2014 11:41:00 +0900"
최초 멜라토닌 성분 수면제 '서카딘' 출시,http://dailymedi.com/nhn/index.php?code=782634,http://dailymedi.com/nhn/index.php?code=782634,서카딘은 내인성 멜라토닌과 유사하게 방출되는 최초 서방형 멜라토닌으로 수면의 질을 개선할 뿐 아니라 기존 약에 비해 부작용이 낮은 것이 특징이다. 회사 측에 따르면 55세 이상 불면증 환자를 대상으로 한 국내... ,"Tue, 22 Jul 2014 11:15:00 +0900"
"건일제약,멜라토닌 성분 불면증 치료제 ‘서카딘’ 출시",http://www.fnnews.com/view?ra=Sent0901m_01A&corp=fnnews&arcid=201407220100246850012488&cDateYear=2014&cDateMonth=07&cDateDay=22&,https://n.news.naver.com/mnews/article/014/0003209673?sid=103,"서카딘은 내인성멜라토닌과 유사하게 방출되는 최초의 서방형멜라토닌으로, 수면의 질을 개선할 뿐만 아니라 기존약에 비해 부작용이 낮은게 특징이다. 실제로 55세 이상의 불면증 환자를 대상으로 한 국내임상에서... ","Tue, 22 Jul 2014 11:10:00 +0900"
"건일제약,멜라토닌 성분 최초 불면증치료제 국내 출시",http://www.yakup.com/news/index.html?mode=view&cat=12&nid=176165,http://www.yakup.com/news/index.html?mode=view&cat=12&nid=176165,"회사 측에 따르면 서카딘®은 내인성멜라토닌과 유사하게 방출되는 최초의 서방형멜라토닌으로, 수면의 질을 개선할 뿐만 아니라 기존약에 비해 부작용이 낮은게 특징이다. 실제로 55세 이상의 불면증 환자를 대상으로... ","Tue, 22 Jul 2014 10:14:00 +0900"
뇌 분비 호르몬 '멜라토닌' 성분 불면증 약 상륙,http://www.dailypharm.com/News/185788,http://www.dailypharm.com/News/185788,이 약의 주성분인 멜라토닌은 뇌에서 분비되는 호르몬인만큼 기존 약에 비해 부작용이 낮은 게 가장 큰 특징이다. 건일제약은 이 제품을 비급여 판매할 것으로 알려져 이르면 내달 이후 시중에 유통될 것으로 보인다.,"Thu, 26 Jun 2014 12:49:00 +0900"
"노인 불면증,멜라토닌을 먼저 점검해보세요",http://health.chosun.com/site/data/html_dir/2017/04/27/2017042701520.html,https://n.news.naver.com/mnews/article/346/0000015086?sid=103,노년층의 불면증은 다른 연령층보다 ‘멜라토닌’과 더 깊은 관련이 있다. 멜라토닌 변화 탓 노년층 절반이... 노년층이 수면제를 복용하면 이점보다 부작용이 더 크다는 사실이 여러 연구에서 밝혀졌다. 단국대병원이... ,"Fri, 05 May 2017 09:00:00 +0900"
"""부작용 최소화""…55세이상 불면증 치료제 ‘멜라원’ 출시",http://www.newsis.com/view/?id=NISX20230113_0002157644&cID=10434&pID=13200,https://n.news.naver.com/mnews/article/003/0011640976?sid=102,등 부작용을 줄인 불면증 치료제가 출시됐다. 한올바이오파마는 불면증 치료제 ‘멜라원서방정2㎎’(이하 멜라원)을 출시했다고 13일 밝혔다. 멜라원(성분명 멜라토닌)은 수면을 유도하는 체내 생성 호르몬 ‘멜라토닌’... ,"Fri, 13 Jan 2023 09:04:00 +0900"
수면장애에 '멜라토닌'‥안전성 면에서 '성공적',http://medipana.com/news/news_viewer.asp?NewsNum=184681&MainKind=A&NewsKind=5&vCount=12&vKind=1,http://medipana.com/news/news_viewer.asp?NewsNum=184681&MainKind=A&NewsKind=5&vCount=12&vKind=1,"폐경기 여성부터 노인, 심지어 소아청소년까지 수면장애를 호소할 경우, 이들에게 맞는 약도 중요하지만 그만큼 부작용 면에서도 자유로워야한다는 의견이다. 수면장애 치료제 중 멜라토닌을 사용한 약은 2014년 7월에... ","Tue, 12 Jul 2016 12:05:00 +0900"
잠 못자면 고혈압·당뇨병 악화…햇빛 쬐고 멜라토닌 복용해야,http://www.koreadaily.com/news/read.asp?art_id=4079441,http://www.koreadaily.com/news/read.asp?art_id=4079441,밤에는 7~8시간 멜라토닌 분비돼야 숙면 만성질환자는 반드시 수면장애를 바로잡아야 한다. 수면제는 효과가 있지만 부작용이 문제다. 아침에 일어나고서도 몽롱하고 어지러운 증상이 있다. 혼돈.환각증세가 나타나는... ,"Wed, 09 Mar 2016 16:29:00 +0900"
"멜라토닌 기능, 스마트폰 블루라이트가 방해…""수면 1시간이나 지연, 액...",http://www.starseoultv.com/news/articleView.html?idxno=366735,http://www.starseoultv.com/news/articleView.html?idxno=366735,"멜라토닌 기능, 스마트폰 멜라토닌 기능, 스마트폰 블루라이트가 방해…""수면 1시간이나 지연, 액정 화면은... 이런 부작용을 막아주는 기술을 개발해야 한다""라고 주장했다. 또한 그링라스 교수는 ""최근 스마트폰 등 여러... ","Mon, 30 Nov 2015 16:22:00 +0900"
"멜라토닌 기능, 주말 잠 몰아자기 '오히려 독?'",http://www.wowtv.co.kr/newscenter/news/view.asp?bcode=T30001000&artid=A201511300132,https://m.entertain.naver.com/article/215/0000400899,"' 멜라토닌 기능과 함께 주말 잠 몰아자기에 대한 연구 결과가 관심을 모으고 있다. 최근 미국 펜실베이니아 대학은 주말에 잠 몰아자기 효과와 부작용에 대한 연구 진행 결과를 전했다. 해당 연구 결과에 따르면, 주말... ","Mon, 30 Nov 2015 09:51:00 +0900"
자다 깨서 천장만 본다면? 수면센터장이 내려주는 숙면 처방전[의사결정...,https://www.nocutnews.co.kr/news/6448444?utm_source=naver&utm_medium=article&utm_campaign=20251228050100,https://n.news.naver.com/mnews/article/079/0004099706?sid=103,"신원철 강동경희대병원 신경과 교수 ""잠을 쫓지 말고 저절로 따라오게 하세요"" 55세 전후 멜라토닌 50% 급감... 말랑말랑해지는 부작용을 낳는다. 더 무서운 것은 '수면 관성'이다. ""깊은 잠을 자다가 억지로 깨어나면... ","Sun, 28 Dec 2025 05:01:00 +0900"
"[Health&Beauty]최초의 멜라토닌 성분 수면제, 불면증 노인 삶의 질 높인...",http://news.donga.com/3/all/20140923/66641382/1,https://n.news.naver.com/mnews/article/020/0002653785?sid=105,[동아일보] 불면증 치료약 ‘서카딘’ 개발자 나바 지사펠 교수 인터뷰 《 멜라토닌은 뇌에서 분비되는 수면... 기존에 복용하던 수면제를 중단할 땐 부작용을 피하기 위해 서서히 약을 줄여나가도록 한다. 서카딘의... ,"Wed, 24 Sep 2014 03:02:00 +0900"
"후덜덜한 ‘졸피뎀’ 부작용, 부지불식간 ‘1000만원 소액결제’까지",http://www.yakup.com/news/index.html?mode=view&cat=13&nid=280470,http://www.yakup.com/news/index.html?mode=view&cat=13&nid=280470,심각한 부작용을 낳는 것으로 확인됐다.  졸피뎀을 복용했다가 기억장애와 의식상태 저하로 인해 자신이... 이 약사는 “수면 개시 불면증 환자의 경우 졸피뎀‧멜라토닌처럼 약 흡수가 비교적 짧게 작용하는 약물이... ,"Tue, 11 Apr 2023 06:02:00 +0900"
멜라토닌 불면증 치료제 서카딘 주목,http://www.doctorsnews.co.kr/news/articleView.html?idxno=98360,http://www.doctorsnews.co.kr/news/articleView.html?idxno=98360,서카딘은 내인성 멜라토닌과 유사한 서방형 멜라토닌 제제로 수면의 질 개선 뿐만 아니라 기존수면제 대비 부작용을 낮춘 것이 특징이다. 기존 수면제가 향정신성의약품으로 1회 3~4주로 처방이 제한된 것에 비해... ,"Thu, 21 Aug 2014 14:19:00 +0900"
"건일제약, 멜라토닌 서방정 '서카딘' 론칭 심포지엄 개최",http://www.monews.co.kr/news/articleView.html?idxno=76047,http://www.monews.co.kr/news/articleView.html?idxno=76047,"서카딘은 내인성 멜라토닌과 유사하게 방출되는 최초의 서방형 멜라토닌으로서 수면의 질을 개선할 뿐만 아니라 기존수면제 대비 부작용을 낮춘 것이 특징이며, 기존 수면제가 향정신성의약품으로 1회 3~4주 처방이... ","Tue, 19 Aug 2014 19:39:00 +0900"
"""멜라토닌 성분 서카딘, 한국인 일차성 불면증에""",http://www.dailypharm.com/News/187573,http://www.dailypharm.com/News/187573,"건일제약 관계자는 ""서카딘은 내인성 멜라토닌과 유사하게 방출되는 최초의 서방형 멜라토닌으로, 수면의 질을 개선할 뿐만 아니라 부작용이 낮은게 특징이다""고 전했다. 이날 행사에는 이 약을 개발한 이스라엘 뉴림사... ","Tue, 19 Aug 2014 06:23:00 +0900"
