title,originallink,link,description,pubDate
"수능 59일전…""식사·수면·운동 무너지면 집중력도 흔들린다""",https://www.news1.kr/bio/welfare-medical/5912678,https://n.news.naver.com/mnews/article/421/0008487096?sid=105,"과도하게 섭취할 경우 불면, 두근거림 등 부작용이 나타날 수 있다. 운동은 뇌 기능을 활성화하고... 햇빛을 일정 시간 쬐는 것도 멜라토닌 분비를 조절해 수면의 질을 높이고 생체 리듬 회복을 도와준다. 책상에 오래 앉아... ","Mon, 15 Sep 2025 15:23:00 +0900"
"부족한 잠, 주말에 몰아 자면 번아웃 온다",http://weekly.chosun.com/news/articleView.html?idxno=44591,https://n.news.naver.com/mnews/article/053/0000052329?sid=105,"생체리듬 불일치가 정신건강 악화에 영향 우울증은 과도한 수면의 흔한 부작용 중 하나다. 잠자는 시간이... 저녁에는 멜라토닌 분비가 증가해 수면을 준비하고, 아침에는 코르티솔이 분비돼 몸을 깨워 활동을 시작하게... ","Mon, 15 Sep 2025 04:01:00 +0900"
[오목대] 밤새 잘 주무셨습니까?,https://www.jjan.kr/article/20250911580094,https://www.jjan.kr/article/20250911580094,'수면 호르몬'인 멜라토닌 분비가 감소하기 때문이다. 우리나라 노인의 86%가 6개 이상의 약제를 복용하고 있어 약물 부작용도 수면에 부정적 영향을 미친다. 그러면 노년기 건강한 수면을 위한 방법은 뭘까.... ,"Thu, 11 Sep 2025 18:48:00 +0900"
"긴 겨울밤, 잠 이루지 못하면 '이것' 점검해야",https://www.sportschosun.com/life/2026-02-10/202602100100064640004363,https://n.news.naver.com/mnews/article/076/0004373253?sid=102,"다만 장기간·고용량 사용 시 인지 기능 저하나 낙상 위험 같은 부작용이 커질 수 있고, 여러 종류의 수면제를... 깊은 수면이 줄고 수면이 끊기기 쉬우며, 수면 각성 리듬을 조절하는 신호 역할을 하는 멜라토닌 분비도... ","Tue, 10 Feb 2026 09:17:00 +0900"
[여름철 노인 수면장애] 오뉴월 바람 불면 잠 못 든다,http://www.knnews.co.kr/news/articleView.php?idxno=1469153,http://www.knnews.co.kr/news/articleView.php?idxno=1469153,"불면증이 만성화돼 수면제를 장기간 복용하면 낙상, 골절, 인지기능 장애, 섬망 등의 부작용이 발생할 수 있다. 연령이 증가함에 따라 일주기 리듬의 변화가 생긴다. 생체 리듬의 전진으로 멜라토닌의 최고점이 젊은... ","Sun, 31 Aug 2025 21:48:00 +0900"
"태극권, 요가, 조깅은 불면증 약만큼 효과 있어",http://www.cancerline.co.kr/html/26807.html,http://www.cancerline.co.kr/html/26807.html,"연구자들은 불면증에 대한 약물 치료는 부작용이 없는 것은 아니며, 인지 행동 치료(CBT)는... 걷기나 조깅은 에너지 소모를 늘리고, 코르티솔 생성을 억제하고, 감정 조절을 개선하고, 수면 호르몬인 멜라토닌... ","Fri, 29 Aug 2025 16:02:00 +0900"
"[명의칼럼] 하지불안증후군, 도파민 결핍 말고도 원인 복잡한 난치성 신...",https://www.viva100.com/article/20250905500587,https://www.viva100.com/article/20250905500587,"신경 안정과 수면유도 호르몬인 멜라토닌의 활성화를 통해 야간 각성 상태의 시간과 빈도를 줄일 수 있다.... 장기 복용 시 용량을 늘려야 하며, 그에 따른 부작용도 만만찮다. 따라서 비약물치료인 엘큐어리젠요법을... ","Fri, 05 Sep 2025 14:54:00 +0900"
암 치료 후 입맛 없을 때 ‘이 과일’ 먹어보자,https://health.chosun.com/site/data/html_dir/2025/09/03/2025090302931.html,https://n.news.naver.com/mnews/article/346/0000096806?sid=103,"고려대안산병원 가정의학과 박주현 교수는 “항암 치료 부작용으로 구내염, 메스꺼움 등으로 음식 섭취가... 바나나에 함유된 아미노산 트립토판과 멜라토닌은 기분 개선과 수면의 질 향상에도 좋다. 바나나를 하루 260g씩... ","Thu, 04 Sep 2025 07:31:00 +0900"
짝퉁·최음제·욱일기 팔아요…‘무법지대’ 알리·테무 [스페셜리포트...,https://www.mk.co.kr/article/10965193,https://n.news.naver.com/mnews/article/024/0000087982?sid=101,사용량이 늘어나면서 그동안 묻혀왔던 여러 부작용이 한 번에 수면 위로 떠오르는 모습이다. 현재 중국... 알리에서는 불면증 치료제에 많이 쓰이는 성분 ‘멜라토닌’ 캡슐제가 ‘수면의 질 향상에 도움을 줄 수 있다’는... ,"Fri, 15 Mar 2024 11:25:00 +0900"
"손흥민, 밤에 '이 증상' 힘들어 이사까지… 뭐에 시달렸길래?",https://health.chosun.com/site/data/html_dir/2024/03/25/2024032501289.html,https://n.news.naver.com/mnews/article/346/0000072397?sid=103,"수면 호르몬인 멜라토닌은 눈에 빛이 들어오지 않아야 원활하게 분비되므로, 침실 환경은 최대한 어둡게... 수면 유도제에는 진정· 수면유도효과가 있지만, 입이 마르거나 배뇨장애, 변비 등의 부작용을 일으킬 수 있다.... ","Mon, 25 Mar 2024 14:48:00 +0900"
짝퉁·최음제·욱일기 팔아요…‘무법지대’ 알리·테무 [스페셜리포트...,https://www.mk.co.kr/article/10953952,https://n.news.naver.com/mnews/article/024/0000087713?sid=101,사용량이 늘어나면서 그동안 묻혀왔던 여러 부작용이 한 번에 수면 위로 떠오르는 모습이다. 현재 중국... 알리에서는 불면증 치료제에 많이 쓰이는 성분 ‘멜라토닌’ 캡슐제가 ‘수면의 질 향상에 도움을 줄 수 있다’... ,"Thu, 29 Feb 2024 14:55:00 +0900"
[2024 KPC CEO 북클럽] 안철우 세브란스 병원 교수 “식욕‧성장‧수면 ...,https://www.news2day.co.kr/article/20240307500127,https://www.news2day.co.kr/article/20240307500127,"그는 ""손목 터널증후군 수술을 받고 부작용에 시달리는 어머니의 모습을 보며 부모와 적절한 상담을 미리... 작품 속 주인공은 멜라토닌 부족으로 피곤해 보인다. 멜라토닌이 부족하면 숙면을 취하기 힘들고, 수면의 질도... ","Thu, 07 Mar 2024 18:34:00 +0900"
불면증 잡아야 행복한 노년기…수면 건강 팁 '3가지',https://www.sportschosun.com/ext/2024-04-03/202404030100023350002370,https://n.news.naver.com/mnews/article/076/0004129400?sid=102,"빛은 수면 호르몬인 멜라토닌과 직접적인 연관이 있기 때문이다. 우리 몸은 해가 떠 있는 동안 행복... 특히 65세 노인의 약 40%는 5가지 이상의 약을 복용하는 것으로 알려져 있는데, 일부 약의 경우 부작용으로 수면에... ","Wed, 03 Apr 2024 09:08:00 +0900"
'생로병사의 비밀' 불면증 비약물 치료법과 수면제 끊는 방법,https://www.gukjenews.com/news/articleView.html?idxno=3355179,https://www.gukjenews.com/news/articleView.html?idxno=3355179,"나이가 들면 수면 유도 호르몬인 멜라토닌 분비가 줄어드는 것은 흔한 일. 그러나 김영란 씨의 불면증은... 되고 부작용이 적어 주목받고 있다. 수면제한요법, 수면일기 기록 등...사례자 3인이 받은 인지행동치료의... ","Wed, 20 Aug 2025 21:22:00 +0900"
"KBS1 '생로병사의 비밀', 당신이 잠 못 드는 이유 - 불면증 편",https://www.wikitree.co.kr/articles/1074599,https://www.wikitree.co.kr/articles/1074599,"나이가 들면 수면 유도 호르몬인 멜라토닌 분비가 줄어드는 것은 흔한 일. 그러나 김영란 씨의 불면증은... 되고 부작용이 적어 주목받고 있다. 수면제한요법, 수면일기 기록 등 사례자 3인이 받은 인지행동치료의... ","Wed, 20 Aug 2025 21:00:00 +0900"
김지호 “갱년기라 밤새 유령처럼 돌아다녀”...‘이 운동’으로 다스린...,https://kormedi.com/?p=2737707,https://n.news.naver.com/mnews/article/296/0000091759?sid=103,"개인 건강 상태에 따라 부작용 및 적응 여부가 다르므로 전문의 상담을 거쳐야 한다. 역시 의료진의 처방에 따라 단기 수면제 또는 간헐적 항우울제를 활용할 수도 있고, 멜라토닌 보충제, 마그네슘 등을 사용하기도 한다.... ","Fri, 01 Aug 2025 15:17:00 +0900"
"60대 이상 특히 주의 필요한 '불면증', 수면의 질 관리 중요성↑",http://www.whosaeng.com/151202,http://www.whosaeng.com/151202,"빛은 수면 호르몬인 멜라토닌과 직접적인 연관이 있기 때문이다. 우리 몸은 해가 떠 있는 동안 행복... 특히 65세 노인의 약 40%는 5가지 이상의 약을 복용하는 것으로 알려져 있는데, 일부 약의 경우 부작용으로 수면에... ","Fri, 29 Mar 2024 11:40:00 +0900"
"수면무호흡증, 하지불안증후군, 나쁜 수면 습관, 수면제를 둘러싼 오해...",https://www.lecturernews.com/news/articleView.html?idxno=185161,https://www.lecturernews.com/news/articleView.html?idxno=185161,"나이가 들면 수면 유도 호르몬인 멜라토닌 분비가 줄어드는 것은 흔한 일. 그러나 김영란 씨의 불면증은... 되고 부작용이 적어 주목받고 있다. 수면제한요법, 수면일기 기록 등... 사례자 3인이 받은 인지행동치료의... ","Wed, 20 Aug 2025 06:00:00 +0900"
"나이들수록 ""잠 잘 못자"", 노년 불면증 개선하는 법 4가지",https://www.healthinnews.co.kr/news/articleView.html?idxno=45677,https://www.healthinnews.co.kr/news/articleView.html?idxno=45677,"빛은 수면 호르몬인 멜라토닌과 직접적인 연관이 있기 때문이다. 우리 몸은 해가 떠 있는 동안 행복... 특히 65세 노인의 약 40%는 5가지 이상의 약을 복용하는 것으로 알려져 있는데, 일부 약의 경우 부작용으로 수면에... ","Thu, 28 Mar 2024 16:32:00 +0900"
[스페셜리포트]中 직구 플랫폼은 '무법지대'…e커머스 생태계 흔든다,https://www.etnews.com/20240221000088,https://n.news.naver.com/mnews/article/030/0003182568?sid=101,멜라토닌은 체내 분비 호르몬으로 불면증 치료에 쓰이는 약물이지만 부작용 우려가 있어 전문의약품으로 분류된다. 식품의약품안전처가 통관금지품목으로 지정했지만 알리익스프레스를 통해 쉽게 구입이 가능하다.... ,"Wed, 21 Feb 2024 10:26:00 +0900"
"""60대 이상부터 급증하는 '불면증', 수면의 질 관리 중요""",https://www.rapportian.com/news/articleView.html?idxno=205120,https://www.rapportian.com/news/articleView.html?idxno=205120,"빛은 수면 호르몬인 멜라토닌과 직접적인 연관이 있기 때문이다. 우리 몸은 해가 떠 있는 동안 행복... 특히 65세 노인의 약 40%는 5가지 이상의 약을 복용하는 것으로 알려져 있는데, 일부 약의 경우 부작용으로 수면에... ","Thu, 28 Mar 2024 15:36:00 +0900"
"‘불면증’ 심해지는 60대 이상, 수면 건강을 지키는 꿀팁 3가지",http://digitalchosun.dizzo.com/site/data/html_dir/2024/03/28/2024032880102.html,http://digitalchosun.dizzo.com/site/data/html_dir/2024/03/28/2024032880102.html,"빛은 수면 호르몬인 멜라토닌과 직접적인 연관이 있기 때문이다. 우리 몸은 해가 떠 있는 동안 행복... 특히 65세 노인의 약 40%는 5가지 이상의 약을 먹는 것으로 알려졌는데, 일부 약의 경우 부작용으로 수면에 영향을 줄... ","Thu, 28 Mar 2024 11:12:00 +0900"
흔한 게 불면증? 60대 이상에겐 질병의 ‘씨앗’ 될 수도 [건강+],http://www.segye.com/newsView/20240328505038?OutUrl=naver,https://n.news.naver.com/mnews/article/022/0003918820?sid=103,"빛은 수면 호르몬인 멜라토닌과 직접적인 연관이 있기 때문이다. 우리 몸은 해가 떠 있는 동안 행복... 특히 65세 노인의 약 40%는 5가지 이상의 약을 복용하는 것으로 알려져 있는데, 일부 약의 경우 부작용으로 수면에... ","Thu, 28 Mar 2024 10:57:00 +0900"
시끄러운 줄로만 알았던 코골이… 알고 보니 뇌졸중 신호? [인터뷰],https://news.hidoc.co.kr/news/articleView.html?idxno=51756,https://news.hidoc.co.kr/news/articleView.html?idxno=51756,약물의 부작용도 영향을 미칩니다. 특히 이비인후과적 관점에서 비중격 만곡과 편도 비대는 반드시 주의... 전자기기의 블루 라이트가 수면 유도 호르몬인 멜라토닌의 분비를 억제해 잠들기 어렵게 만들기 때문입니다.... ,"Tue, 19 Aug 2025 18:00:00 +0900"
"박서진, 10년 넘게 중증 불면증 시달려… 노래 부르다 필름 끊기기도?",https://health.chosun.com/site/data/html_dir/2024/02/22/2024022201723.html,https://n.news.naver.com/mnews/article/346/0000070930?sid=004,"멜라토닌이 풍부해 생체리듬 조절에 효과적이다. 올바른 수면 유도제 사용도 불면증 증상을 쉽게 없애는 방법이다. 다만 오랫동안 복용하면 약에 대한 내성이 생겨 수면 유도제에 지나치게 의존하게 되고, 여러 부작용을... ","Thu, 22 Feb 2024 14:02:00 +0900"
"알리익스프레스, 불법약품에 무기까지...‘무법지대’ 논란",https://www.mk.co.kr/article/10947807,https://n.news.naver.com/mnews/article/024/0000087572?sid=102,멜라토닌은 체내에서 분비되는 호르몬으로 불면증 치료제에 많이 사용되나 호르몬제 특성상 두통이나 어지러움 등의 부작용을 일으킬 수 있어 국내에서는 유통이 제한됐다. 2014년 식약처는 안전성 등을 이유로 멜라토닌... ,"Wed, 21 Feb 2024 16:08:00 +0900"
욱일기·수면제도 버젓이..알리익스프레스 막무가내식 판매,https://www.busan.com/view/busan/view.php?code=2024022110395902787,https://n.news.naver.com/mnews/article/082/0001256580?sid=101,하지만 호르몬제 특성상 두통이나 어지러움 등 부작용이 나타날 수 있어 국내에서는 유통이 엄격히 제한된다. 식품의약품안전처는 2014년 안전성 등을 이유로 멜라토닌을 의사 처방이 필요한 전문의약품으로 분류했다.... ,"Wed, 21 Feb 2024 10:41:00 +0900"
팔방미인 '바나나' 먹으면 위험한 사람은,http://www.joseilbo.com/news/news_read.php?uid=550567&class=27&grp=,https://n.news.naver.com/mnews/article/123/0002366034?sid=103,"바나나에는 마그네슘과 트립토판이 들어 있어 근육을 이완시키고 세로토닌, 멜라토닌 생성을 촉진한다.... 잠재적 부작용을 이해하고 섭취량을 조절하면 바나나는 여전히 건강한 식단의 중요한 일부가 될 수 있다.","Sat, 16 Aug 2025 14:16:00 +0900"
이렇게만 하면 열대야에도 ‘꿀잠’ 보장…“부모님께 꼭 알려드리세요...,https://www.sedaily.com/NewsView/2GVIW1T0C5,https://n.news.naver.com/mnews/article/011/0004514087?sid=102,"노화와 함께 멜라토닌 분비가 감소하면서 잠드는 시간이 빨라지고, 새벽에 일찍 깨어나는 현상이 나타난다.... 하지만 수면제는 단기적인 효과가 있을지 몰라도 장기 복용 시 인지저하, 낙상 위험, 기억력 장애 등의 부작용... ","Mon, 28 Jul 2025 05:34:00 +0900"
불면증에 좋은 일반약 '이렇게 조합해 보자!',https://www.kpanews.co.kr/article/show.asp?idx=248480&category=H,https://www.kpanews.co.kr/article/show.asp?idx=248480&category=H,"일반의약품으로는 독실아민, 디펜히드라민 같은 항히스타민제가 사용되고, 외국의 경우 멜라토닌을... 초기에 개발된 1세대 H1 길항제는 효과는 좋으나 BBB를 잘 통과해 진정, 졸음 부작용이 컸다. 2세대 H1 길항제는 주로... ","Tue, 06 Feb 2024 12:38:00 +0900"
"여름 슈퍼푸드 '체리', 효능과 섭취법 완벽 가이드 [과일톡(Talk)]",https://news.hidoc.co.kr/news/articleView.html?idxno=51503,https://news.hidoc.co.kr/news/articleView.html?idxno=51503,추가로 체리에 함유된 멜라토닌이 수면 개선에 도움이 된다는 연구 결과들이 일부 보고되고 있지만 이 또한... 그러나 잘못된 섭취 방법이나 정보 부족으로 인해 오히려 부작용이 발생하는 경우도 적지 않다. 이에... ,"Wed, 13 Aug 2025 16:00:00 +0900"
"수면 보조식품 '근심이정', 3차 물량 완판···식물성 영양제로 주목",https://www.enetnews.co.kr/news/articleView.html?idxno=40359,https://www.enetnews.co.kr/news/articleView.html?idxno=40359,"'근심이정'은 단순히 멜라토닌에만 의존하지 않고, 마음을 편안하게 하는데 착안한 성분 구성인 흑하랑상추... 이러한 접근 방식은 부작용 우려를 낮추고 일상적인 복용에 대한 수용도를 높이는 데 기여한다""고 설명했다.... ","Wed, 23 Jul 2025 10:26:00 +0900"
가임기 여성 위협하는 '다낭성 난소증후군'… 개선해야 할 생활습관 3 [...,https://news.hidoc.co.kr/news/articleView.html?idxno=50223,https://news.hidoc.co.kr/news/articleView.html?idxno=50223,피임약 장기복용 시 난소기능 저하와 혈전 위험 증가 등 부작용이 나타날 수 있기 때문이다. 한의사 정소영... 수면 중 분비되는 멜라토닌과 성장 호르몬은 생식 호르몬에 직접적인 영향을 줍니다. 특히 성장 호르몬은 밤... ,"Tue, 15 Jul 2025 14:00:00 +0900"
노화 수반 기억력 저하 원인 밝혀져,http://www.bosa.co.kr/news/articleView.html?idxno=2215205,http://www.bosa.co.kr/news/articleView.html?idxno=2215205,멜라토닌은 수면을 촉진하는 건강보조제로도 널리 사용되고 있어 사람에서 부작용이 거의 없는 것으로 이미 확인되고 있다. AMK를 기반으로 한 신약 개발은 노화로 인한 기억장애와 치매 전단계인 경도인지장애(MCI)의... ,"Wed, 24 Jan 2024 06:02:00 +0900"
"중국 직구 ‘알리’, 불법으로 치료약 팔고… 욱일문양 상품 광고까지",https://www.munhwa.com/news/view.html?no=2024022101070807205001,https://n.news.naver.com/mnews/article/021/0002622482?sid=101,"멜라토닌은 체내에서 분비되는 호르몬으로, 광고대로 불면증 치료제에 많이 쓰이는 약물이다. 하지만 호르몬제 특성상 두통이나 어지러움 등 부작용이 나타날 수 있어 국내에서는 유통이 엄격히 제한된다. 도수 있는... ","Wed, 21 Feb 2024 11:55:00 +0900"
잠 못 드는 세계인 발길 멈춘 ‘K-수면테크’는? [CES 뒤풀이],http://www.segye.com/newsView/20240119512463?OutUrl=naver,https://n.news.naver.com/mnews/article/022/0003896678?sid=101,코자아는 자연추출원료와 체내 필수 영양소만을 넣어 수면 호르몬인 멜라토닌을 체내에서 직접 만들도록 해 부작용 없이 건강하게 수면을 유도하는 음료다. 세계 최대 가전·정보기술(IT) 전시회 ‘CES 2024’에 참가한... ,"Sat, 20 Jan 2024 14:31:00 +0900"
[Who Is ?] 이병기 신신제약 대표이사 사장,https://www.businesspost.co.kr/BP?command=article_view&num=339507,https://www.businesspost.co.kr/BP?command=article_view&num=339507,"다른 수면제에 비해 환각, 중독 등의 부작용이 적어 안정성이 높은 약물로 알려졌다. 앞서 신신제약은 2023년 2월23일 '멜라토닌을 함유하는 경피흡수제제'로 이를 특허 등록했다. 기존 입으로 복용하는 경구제형... ","Wed, 17 Jan 2024 08:34:00 +0900"
"로맨시브, 수면음료 코자아 CES 2024 진출",https://www.joongang.co.kr/article/25221326,https://n.news.naver.com/mnews/article/025/0003334531?sid=101,코자아는 독자적인 유산균 발효 기술을 통해 자연추출원료와 체내 필수 영양소만을 넣어 수면 호르몬인 멜라토닌을 체내에서 직접 만들도록 하여 부작용 없이 건강하게 수면 효과를 볼 수 있다는 점에서... ,"Thu, 11 Jan 2024 18:10:00 +0900"
[신간산책] '진짜 호르몬 때문일까?' - 우울증부터 도파민 중독까지,http://www.veritas-a.com/news/articleView.html?idxno=565316,http://www.veritas-a.com/news/articleView.html?idxno=565316,"아직 부작용이 충분히 밝혀지지 않았고, 젖소에게 성장호르몬을 투여해 우유 생산량을 늘리는 사례처럼 그... 몰입과 쾌락의 '도파민', 잠을 부르는 '멜라토닌', 하루의 시작을 알리는 '코르티솔' 등 그 역할과 특징은 매우... ","Tue, 29 Jul 2025 08:52:00 +0900"
"[신간도서] 『완전관해』 ""통합의학적 자기 치유를 통해 완전관해를 이...",https://www.lecturernews.com/news/articleView.html?idxno=182770,https://www.lecturernews.com/news/articleView.html?idxno=182770,수면 중 멜라토닌 분비와 면역계 회복은 치유 여정의 숨은 핵심이었다. △사이먼튼 심리치료 – 마음에... 여러 이유로 환자 중에는 표준치료의 과정과 결과 또는 부작용에 대해서도 정확히 인식하지 못하고 담당 의사의... ,"Wed, 16 Jul 2025 16:40:00 +0900"
‘이 과일’ 아침식사로는 먹지 마세요…영양사의 과일 점수표 [라이프...,https://www.seoul.co.kr/news/life/health-news/2025/07/24/20250724500250?wlog_tag3=naver,https://n.news.naver.com/mnews/article/081/0003561131?sid=103,약물의 체내 농도를 과도하게 높이거나 희석해 부작용을 유발하거나 약물의 효능을 감소시킬 수 있기... 니콜라는 “체리에는 항산화 물질과 더불어 수면 주기를 조절하는 호르몬인 멜라토닌이 풍부하다”고 설명했다. 또... ,"Sat, 26 Jul 2025 06:01:00 +0900"
"[르포] 반입 금지된 불법 의약품, 남대문 시장 수입상가에선 내놓고 파...",https://biz.chosun.com/topics/topics_social/2025/07/05/ZVF3JBRAPRHQ7NPUZNDK34TFEA/?utm_source=naver&utm_medium=original&utm_campaign=biz,https://n.news.naver.com/mnews/article/366/0001090127?sid=102,다른 상점에서는 수면에 도움을 멜라토닌도 팔고 있었다. 이 약은 미국 등지에서는 쉽게 구할 수 있지만... 반면 수입 과자를 사러 온 권모(27)씨는 “금지된 성분이 포함된 약을 대놓고 판다니 이상하다”며 “부작용도... ,"Sat, 05 Jul 2025 06:02:00 +0900"
영양제 많이 먹으면 간수치 높아질까?,https://www.hani.co.kr/arti/society/health/1205808.html,https://n.news.naver.com/mnews/article/028/0002753875?sid=102,"수면을 유도하는 데 도움을 주는 멜라토닌 역시 밤 시간대에 복용하는 것이 좋아요. 간 기능을 보호하고... 특별한 부작용이 없으나, 혹시라도 설사 등의 위장장애가 생기면 용량을 줄이거나 잠시 섭취를 멈추는 것이... ","Wed, 02 Jul 2025 08:54:00 +0900"
“언제쯤 푹 자보나…” 수면장애로 지난해 110만 명 진료 받아,https://www.hankookilbo.com/News/Read/A2023120112200003389?did=NA,https://n.news.naver.com/mnews/article/469/0000773442?sid=103,의사 처방전 없이 약국에서 살 수 있는 일반 수면유도제는 졸림을 부작용으로 동반하는 감기약 계열 약이다. 수면을 유도하는 멜라토닌을 보충하는 ‘서카딘(서방형 멜라토닌)’도 있다. 이유진 서울대병원... ,"Sun, 03 Dec 2023 22:31:00 +0900"
머리만 대면 바로 잠드는 사람...건강하단 뜻? 진실은,https://kormedi.com/?p=1643800,https://n.news.naver.com/mnews/article/296/0000072311?sid=103,"멜라토닌을 소량으로 복용하는 건 대개 안전하지만, 너무 많은 양을 복용할 경우 두통, 고혈압 또는 저혈압, 낮 시간 졸음, 구토 등의 부작용이 나타날 수 있다는 연구 결과가 있다. 휴스턴 메서디스트 프라이머리 케어... ","Sat, 09 Dec 2023 16:21:00 +0900"
"""아무리 덥고 피곤해도 '이 시간' 이후 커피는 참으세요…하루가 망가집...",https://www.wikitree.co.kr/articles/1062612,https://www.wikitree.co.kr/articles/1062612,"떨어지는 부작용도 동반된다. 여름철 오후, 차가운 커피는 갈증 해결보다 불쾌감 유발로 이어질 수 있는... 카페인은 수면 호르몬인 멜라토닌의 분비를 방해하고, 뇌를 각성 상태로 유지시킨다. 이로 인해 새벽까지... ","Fri, 04 Jul 2025 15:50:00 +0900"
"[집중리포트] 잠자리에 드는 순간, 하루가 시작된다",http://www.brainmedia.co.kr/Opinion/23822,http://www.brainmedia.co.kr/Opinion/23822,"노인에게 약물치료가 자주 사용되나 부작용이 있기도 하므로 권장되지는 않는다. 불면증에 대한 약물치료인... 또한 나이와 비례해 혈청 멜라토닌 농도가 감소하는데, 이는 수면장애와 직결된다.기능을 활성화하면... ","Wed, 06 Dec 2023 14:02:00 +0900"
"""항우울제, 어떻게 선택할까?""... 증상별 선택 기준과 주의점",https://news.hidoc.co.kr/news/articleView.html?idxno=48888,https://news.hidoc.co.kr/news/articleView.html?idxno=48888,"환자의 증상 프로필, 과거 치료 반응, 동반 질환, 부작용에 대한 우려 등 다양한 요소를 고려한 개인화된... ⑥ 멜라토닌 수용체 작용제: 수면-각성 주기 조절 및 우울 증상 개선(예: 아고멜라틴) ⑦ 다중 수용체 작용... ","Wed, 18 Jun 2025 20:00:00 +0900"
"""선생님 잠이 안 와요""…교사가 나눠준 수상한 젤리 정체는?",http://news.heraldcorp.com/view.php?ud=20231015000148,https://n.news.naver.com/mnews/article/016/0002210110?sid=104,"다만, 과다 복용할 경우 호흡곤란, 구토, 복통 등의 부작용이 나타날 수 있다. 이에 미국수면학회(AASM)는 ""멜라토닌 사용 증가로 인한 어린이 응급실 방문수도 급증했다""며 지난해 13세 미만의 어린이에게 멜라토닌이 든... ","Sun, 15 Oct 2023 16:46:00 +0900"
